使用 =tcpdump= 分析与 www.baidu.com 连接时的三次握手
#+begin_src sh :dir /sudo:: :results output :exports both
  tcpdump dst host www.baidu.com or src host www.baidu.com -c 3 -S -n & telnet www.baidu.com 443 << EOF
  quit
  EOF
  echo
#+end_src

#+RESULTS:
: Trying 182.61.200.6...
: 22:02:42.702771 IP 192.168.2.102.62705 > 182.61.200.6.443: Flags [S], seq 308578415, win 65535, options [mss 1460,nop,wscale 6,nop,nop,TS val 828818586 ecr 0,sackOK,eol], length 0
: 22:02:42.749010 IP 182.61.200.6.443 > 192.168.2.102.62705: Flags [S.], seq 782301551, ack 308578416, win 8192, options [mss 1448,nop,wscale 5,nop,nop,nop,nop,nop,nop,nop,nop,nop,nop,nop,nop,sackOK,eol], length 0
: 22:02:42.749043 IP 192.168.2.102.62705 > 182.61.200.6.443: Flags [.], ack 782301552, win 4096, length 0
: Connected to www.a.shifen.com.
: Escape character is '^]'.
: 
